Puzzle #,Date,Day,Slot,Event,Year,Difficulty,Tier,Headline,Clue 1,Clue 2,Context Card
1,2026-03-31,Tuesday,0,"Nelson Mandela Released From Prison",1990,4,1,"Nelson Mandela Released From Prison","The Berlin Wall had fallen just months before","South Africa was still three years from its first democratic election","Nelson Mandela had spent 18 of his 27 years imprisoned on Robben Island, a bleak outcrop in Table Bay. By the time he walked free on February 11th, 1990, he had become the most famous political prisoner in the world. Within four years, he was president."
2,2026-03-31,Tuesday,1,"Apollo 11 Moon Landing",1969,3,1,"The Apollo 11 Moon Landing","Woodstock was just weeks away","The Boeing 747 had not yet carried a single passenger","Neil Armstrong's first steps on the Moon were watched by an estimated 600 million people — one-fifth of the world's population. The lunar module was called Eagle. Armstrong had only 30 seconds of fuel remaining when he found a landing spot. He called it 'magnificent desolation.'"
3,2026-03-31,Tuesday,2,"The Titanic Sinks",1912,3,1,"The Titanic Sinks on Maiden Voyage","The Panama Canal was still under construction","Fenway Park opened the same week","The Titanic was carrying some of the world's wealthiest people and hundreds of immigrants seeking a new life in America. It struck the iceberg at 11:40 PM and sank in under three hours. The nearby RMS Carpathia rescued 705 survivors. The disaster led to major changes in maritime safety regulations."
4,2026-04-01,Wednesday,0,"JFK Assassinated in Dallas",1963,4,1,"JFK Assassinated in Dallas","Martin Luther King Jr. had just delivered his most famous speech that summer","The Beatles would land in America for the first time within three months","Lee Harvey Oswald fired three shots from the sixth floor of the Texas School Book Depository on November 22nd, 1963. Kennedy was pronounced dead at 1:00 PM. Two days later, Oswald was shot by nightclub owner Jack Ruby in the Dallas Police Department basement — live on national television. The truth of what happened that day has never fully left public debate."
5,2026-04-01,Wednesday,1,"World Wide Web Invented",1989,5,1,"World Wide Web Invented","The Exxon Valdez had just run aground in Alaska","Nintendo's Game Boy went on sale that same spring","Tim Berners-Lee's original proposal at CERN was returned with the note: 'Vague, but exciting.' He wanted a way for physicists to share documents across different computers. The first web page went live in 1991, and Berners-Lee never patented his invention — he gave it away for free, insisting the web should belong to everyone."
6,2026-04-01,Wednesday,2,"Chernobyl Nuclear Disaster",1986,5,1,"Chernobyl Nuclear Disaster","The Space Shuttle Challenger had been lost earlier that same year","Maradona's 'Hand of God' goal happened weeks later at the World Cup","On April 26, 1986, Reactor 4 at Chernobyl exploded during a low-power test. The fire released radioactive material 9 kilometers into the atmosphere. Soviet authorities evacuated Pripyat (population 49,000) 36 hours later. The final death toll remains disputed — from 31 immediate deaths to estimates of thousands of cancer cases from radiation exposure. The destroyed reactor was finally enclosed in a giant steel sarcophagus in 2016."
7,2026-04-02,Thursday,0,"D-Day: Allied Forces Land at Normandy",1944,6,1,"D-Day: Allied Invasion of Normandy","Roosevelt was serving an unprecedented third term as US president","","On June 6th, 1944, the Allies launched the most complex military operation in history. Paratroopers had already dropped behind enemy lines by the time the first landing craft hit the beaches at 6:30 AM. The cost was enormous — over 4,000 Allied soldiers died on D-Day alone — but within a year, Germany had surrendered."
8,2026-04-02,Thursday,1,"First iPhone Released",2007,5,1,"First iPhone Released","The final Harry Potter book was published that same summer","","Steve Jobs unveiled the iPhone on January 9, 2007, calling it 'a revolutionary product.' It didn't go on sale until June, but it immediately changed what people expected from mobile devices. The initial model had no App Store — that came in 2008. By 2011, the iPhone had made Apple the most valuable company in the world."
9,2026-04-02,Thursday,2,"Watergate Break-In",1972,7,1,"The Watergate Break-In","Nixon had just returned from his historic visit to China that same year","","The five men arrested inside the Democratic National Committee headquarters at 2:30 AM were carrying wiretapping equipment and $2,300 in sequential hundred-dollar bills. A security guard named Frank Wills noticed tape on a door lock and called the police. What began as a third-rate burglary unraveled into the greatest political scandal in American history, ending a presidency two years later."
10,2026-04-03,Friday,0,"The Atomic Bomb Drops on Hiroshima",1945,6,1,"Atomic Bomb Dropped on Hiroshima","Mussolini had been executed by partisans just months earlier","","The Manhattan Project had cost two billion dollars and employed hundreds of thousands of people — most of whom had no idea what they were building. On August 6th, 1945, the result was dropped on Hiroshima. Three days later, a second bomb fell on Nagasaki. Japan surrendered on August 15th. The atomic age had begun."
11,2026-04-03,Friday,1,"Fall of the Soviet Union",1991,6,1,"Fall of the Soviet Union","The World Wide Web had just become publicly available that August","","On December 26, 1991, the Supreme Soviet of the USSR ratified the Belovezh Accords, formally ending the Soviet Union. What had been the world's largest country by area splintered into 15 independent nations. For 69 years, the Soviet experiment had shaped global politics. Its end brought both hope for a new world order and anxiety about nuclear weapons in unstable new states."
12,2026-04-03,Friday,2,"The Wright Brothers' First Flight",1903,6,1,"The Wright Brothers' First Flight","The first Tour de France was held that same summer","","The Wright Brothers made four flights at Kitty Hawk on December 17th, 1903. The first lasted just 12 seconds and covered 120 feet. By the end of that day, they had flown a total of 59 seconds. Orville would later say that the sensation of flight never fully wore off on him — it just kept getting better."
13,2026-04-04,Saturday,0,"Lindbergh's First Solo Transatlantic Flight",1927,7,1,"Lindbergh Flies Solo Across the Atlantic","Jazz ruled the speakeasies and hemlines were rising","","The Spirit of St. Louis was so loaded with fuel at takeoff that it barely cleared the telephone wires at the end of the runway. Charles Lindbergh landed at Le Bourget at 10:22 PM on May 21st, 1927, and was immediately mobbed by the crowd. He became the most famous man in the world overnight — and remained so for the rest of his life, for better and worse."
14,2026-04-04,Saturday,1,"Cuban Missile Crisis",1962,8,1,"The Cuban Missile Crisis","Marilyn Monroe had sung 'Happy Birthday' to the president that summer","","For thirteen days in October 1962, the world came closer to nuclear war than it ever has before or since. Soviet ships carrying additional missiles turned back at the US naval blockade. Soviet leader Khrushchev eventually agreed to remove the missiles in exchange for a US pledge not to invade Cuba and a secret agreement to remove American missiles from Turkey. The crisis was resolved — but only barely."
15,2026-04-04,Saturday,2,"Rosa Parks Refuses to Give Up Her Seat",1955,7,1,"Rosa Parks Refuses to Give Up Her Seat","Rock and roll was new, Disneyland had just opened its gates","","Rosa Parks was not simply tired from work when she refused to move — she was tired of giving in. She had been trained at the Highlander Folk School, a center for civil rights activism. Her arrest on December 1st, 1955 was strategic: the NAACP had been looking for a test case. The resulting boycott lasted 381 days and ended with the Supreme Court ruling bus segregation unconstitutional."
16,2026-04-05,Sunday,0,"The Challenger Disaster",1986,8,1,"The Challenger Disaster","","","Engineers at Morton Thiokol had warned NASA the night before launch that O-rings could fail in temperatures below 53°F — and it was 28°F at Cape Canaveral that morning. Their objections were overruled. The Rogers Commission that investigated the disaster famously included physicist Richard Feynman, who demonstrated the O-ring failure with a glass of ice water at a press conference."
17,2026-04-05,Sunday,1,"September 11 Attacks",2001,8,1,"The September 11 Attacks","","","On September 11, 2001, nearly 3,000 people were killed in a series of coordinated terrorist attacks. The FBI quickly opened an investigation called PENTTBOM. Within days, President George W. Bush had signed the USA PATRIOT Act. The attacks reshaped American foreign policy, airport security, and domestic surveillance in ways still felt today."
18,2026-04-05,Sunday,2,"Pearl Harbor Attack",1941,8,1,"Attack on Pearl Harbor","","","The attack on Pearl Harbor lasted just under two hours but destroyed or damaged 19 Navy ships and 328 aircraft. Of the 2,403 Americans killed, nearly half died aboard the USS Arizona, which sank in nine minutes. Japan had intended to deliver a formal declaration of war before the attack, but the message arrived late — turning a military strike into something Americans would never forgive."
19,2026-04-06,Monday,0,"First Human in Space",1961,3,1,"First Human in Space","The Berlin Wall went up later that same summer","A new American president had just taken office promising a New Frontier","Yuri Gagarin orbited Earth in Vostok 1 on April 12, 1961, completing one orbit in 108 minutes. At 27, he became the first human to see Earth from space. He parachuted from his capsule before it landed — ejection at 7km was standard procedure. A city in Kazakhstan was renamed Baikonur in his honor, and his face became a symbol of Soviet achievement."
20,2026-04-06,Monday,1,"French Revolution Begins",1789,3,1,"French Revolution Begins","George Washington had just been inaugurated as the first US president","Mozart was composing his last operas in Vienna","On July 14, 1789, several hundred Parisians stormed the Bastille, a medieval fortress that had become a symbol of royal tyranny. They freed the seven prisoners inside and killed the governor. The event became the defining moment of the French Revolution and is now commemorated annually as Bastille Day, France's national holiday."
21,2026-04-06,Monday,2,"Declaration of Independence",1776,2,1,"Declaration of Independence Signed","Adam Smith published The Wealth of Nations the same year","Captain Cook was on his third and final voyage","Thomas Jefferson drafted the Declaration of Independence in seventeen days. Congress made 86 changes to his draft, cutting roughly a quarter of the text — including a passage condemning the slave trade. The final document was signed by 56 men, many of whom knew they were signing what could become their death warrant."
22,2026-04-07,Tuesday,0,"MLK I Have a Dream",1963,4,1,"MLK's ""I Have a Dream"" Speech","The Beatles released 'Please Please Me' earlier that year","A nuclear test ban treaty was signed that same summer","The March on Washington was organized in just two months. King's most famous lines — 'I have a dream' — were partly improvised; gospel singer Mahalia Jackson shouted 'Tell them about the dream, Martin!' from behind him on the stage. The prepared text had no mention of dreams."
23,2026-04-07,Tuesday,1,"First Email Sent",1971,5,1,"First Email Sent","Intel had just released its first microprocessor","The Pentagon Papers were published in The New York Times that same year","Ray Tomlinson sent the first email in 1971, choosing the @ symbol to separate the user name from the computer name. The message itself was largely forgettable — something like 'QWERTYUIOP.' But the @ sign became Tomlinson's lasting contribution to digital communication, now used in billions of email addresses worldwide."
24,2026-04-07,Tuesday,2,"Google Founded",1998,5,1,"Google Founded","The Lewinsky scandal dominated American headlines","Titanic was the year's biggest film at the box office","Larry Page and Sergey Brin met at Stanford in 1995 and initially didn't get along. Their search algorithm, PageRank, ranked websites by their links rather than keywords. Their first office was a garage rented from a friend. The name 'Google' came from 'googol,' a mathematical term for 1 followed by 100 zeros."
25,2026-04-08,Wednesday,0,"Amazon Founded",1994,6,1,"Amazon Founded","Nelson Mandela had just been elected president of South Africa","The first PlayStation launched in Japan that December","Jeff Bezos left his hedge fund job in 1994 to start an online bookstore, originally called Cadabra. He chose the name Amazon because it sounded 'exotic and different,' and the Amazon River was the biggest river he could think of. He raised $1 million from his own parents — the minimum viable investment to start. By 2020, Amazon had a market cap of $1.7 trillion."
26,2026-04-08,Wednesday,1,"DNA Structure Discovered",1953,5,1,"DNA Double Helix Discovered","Edmund Hillary and Tenzing Norgay summited Everest weeks later","Elizabeth II had just been crowned Queen of England","Watson and Crick published their double helix model in Nature on April 25, 1953. Their famous line: 'It has not escaped our notice that the specific pairing we have postulated immediately suggests a possible copying mechanism for the genetic material.' Rosalind Franklin's Photo 51, which showed the helix structure, was critical — but she died in 1958 and never shared the Nobel Prize."
27,2026-04-08,Wednesday,2,"HIV/AIDS First Identified",1981,6,1,"HIV/AIDS First Identified","MTV broadcast its first music video that August","The IBM personal computer went on sale for the first time","The CDC's Morbidity and Mortality Weekly Report on June 5, 1981, documented five young gay men in Los Angeles with a rare pneumonia. By the end of 1981, there were 159 reported cases. The disease wouldn't be called AIDS until 1982, and the HIV virus wouldn't be identified until 1984. It would eventually kill 35 million people worldwide."
28,2026-04-09,Thursday,0,"First Heart Transplant",1967,6,1,"First Human Heart Transplant","The Summer of Love had just swept through San Francisco","","Christiaan Barnard performed the first human heart transplant in Cape Town on December 3, 1967, replacing the heart of Louis Washkansky with that of a young woman killed in a car accident. The operation took nine hours. Washkansky survived just eighteen days before dying of pneumonia — but Barnard had proved it could be done, and within a year, more than a hundred transplants followed worldwide."
29,2026-04-09,Thursday,1,"Polio Vaccine Announced",1955,6,1,"Polio Vaccine Announced","Disneyland opened its gates in Anaheim that same summer","","When Jonas Salk's polio vaccine was declared 'safe, effective, and potent' on April 12, 1955, church bells rang across America. Polio had paralyzed an average of 35,000 people each year during the early 1950s. Salk famously refused to patent the vaccine — when asked who owned it, he replied, 'The people. Could you patent the sun?'"
30,2026-04-09,Thursday,2,"Penicillin Discovered",1928,6,1,"Penicillin Discovered","Mickey Mouse made his first appearance on screen that same year","","Alexander Fleming returned from holiday to find a petri dish contaminated by a mold that had killed the surrounding bacteria. He nearly threw it away. It took another decade and two other scientists — Florey and Chain — to turn his observation into a usable drug. By D-Day, there was enough penicillin to treat every wounded Allied soldier on the beaches of Normandy."
31,2026-04-10,Friday,0,"Instagram Launched",2010,7,1,"Instagram Launched","The iPad had just debuted earlier that same year","","The app gained 25,000 users on its first day — before it even existed on Android. Built in eight weeks, it nearly launched under the name 'Burbn' before a pivot stripped everything except photo filters and sharing. Within two years, a billion-dollar acquisition made it the most expensive purchase-per-employee in tech history."
32,2026-04-10,Friday,1,"YouTube Founded",2005,7,1,"YouTube Founded","Hurricane Katrina footage flooded the platform months after launch","","The first video ever uploaded — 18 seconds of a man at the San Diego Zoo — set the tone for what would become the world's second-largest search engine. Three former payment-company employees built it above a pizzeria, and within 18 months sold it for $1.65 billion. The site now serves over a billion hours of video daily, more than broadcast television and Netflix combined."
33,2026-04-10,Friday,2,"Wikipedia Launched",2001,7,1,"Wikipedia Launched","The dot-com bubble had just burst, leaving server space cheap","","Its founder originally envisioned an expert-written encyclopedia called Nupedia, which produced exactly 12 articles in its first year. The pivot to open editing was meant as a feeder project, but within weeks the wiki had outpaced its parent. A 2005 Nature study found its science articles contained roughly the same error rate as Encyclopædia Britannica."
34,2026-04-11,Saturday,0,"Euro Currency Launched",1999,7,1,"Euro Currency Introduced","A millennium's last quiet revolution, sealed before the champagne corks flew","","The Euro was introduced as an accounting currency on January 1, 1999, with physical notes and coins following on January 1, 2002. Twelve countries abandoned their national currencies — including the Deutsche Mark, French Franc, and Italian Lira — for the first time in history. The transition was initially chaotic in some countries, with ATM glitches and confusion at stores."
35,2026-04-11,Saturday,1,"Nintendo Game Boy Released",1989,7,1,"Nintendo Game Boy Released","Cold War concrete was crumbling in Europe while children everywhere stared down at their palms","","Competitors offered color screens, backlighting, and superior processors — and lost. The device's designer deliberately chose outdated screen technology because it consumed so little power that four AA batteries lasted 30 hours. Bundled with a puzzle game from the Soviet Union, it sold 118 million units and proved that portability mattered more than performance."
36,2026-04-11,Saturday,2,"Black Tuesday Stock Crash",1929,8,1,"Black Tuesday Stock Crash","Talkies had just killed the silent film star; now silence fell on the trading floor","","The ticker tape ran so far behind actual trades that brokers were selling stocks without knowing their real price. Sixteen million shares changed hands that day — a volume record that stood for nearly 40 years. The market wouldn't return to its pre-crash peak until 1954, a full quarter-century later."
37,2026-04-12,Sunday,0,"First Photograph Taken",1826,9,1,"First Photograph Taken","","","The exposure required roughly eight hours of direct sunlight, producing a grainy view of rooftops and a courtyard from an upstairs window in Burgundy. The inventor had been experimenting with light-sensitive bitumen for nearly a decade, failing repeatedly before this single surviving image. It now lives in a climate-controlled case at the University of Texas, so faded it can only be seen when lit at a precise angle."
38,2026-04-12,Sunday,1,"First Telegraph Message",1844,9,1,"First Telegraph Message Sent","","","The message traveled 40 miles from the Capitol in Washington to a railroad depot in Baltimore in less than a second — a speed that made newspaper editors openly anxious about the future of their profession. Within a decade, wire stretched across the continent; within two, it crossed the Atlantic Ocean floor."
39,2026-04-12,Sunday,2,"Printing Press Invented",1440,9,1,"Printing Press Invented","","","The technology itself wasn't new — China had movable type four centuries earlier — but the innovation was combining it with a converted wine press, oil-based ink, and a metal alloy that could survive thousands of impressions. Within 50 years, an estimated 20 million volumes had been produced across Europe, more than all the scribes of the previous millennium combined."
40,2026-04-13,Monday,0,"American Civil War Begins",1861,2,1,"American Civil War Begins","Abraham Lincoln had been inaugurated just weeks before the first shots","The Pony Express was still carrying mail across the western frontier","The 34-hour bombardment killed no one on either side — the only fatality came during the surrender ceremony, when a cannon exploded. The fort's commander had personally trained several of the Confederate officers now firing on him. Four years and 620,000 deaths later, he returned to raise the same flag he'd been forced to lower."
41,2026-04-13,Monday,1,"Spanish Flu Pandemic",1918,3,1,"Spanish Flu Pandemic Begins","The Great War was grinding through its final year in Europe","Ragtime was giving way to early jazz in American dance halls","It killed more people in 24 weeks than HIV/AIDS killed in 24 years, yet wartime censorship kept it out of headlines in combatant nations — only neutral Spain reported freely, which is how a Kansas-origin virus got a Spanish name. The second wave struck healthy adults aged 20-40 hardest. Global death estimates range from 50 to 100 million, making the true toll permanently unknowable."
42,2026-04-13,Monday,2,"Elvis Presley First TV Appearance",1956,3,1,"Elvis Presley's First TV Appearance","The Interstate Highway System had just been authorized by Congress","The Hungarian Revolution was making front-page news that autumn","CBS cameras were ordered to film from the waist up, but the damage was already done — his appearance weeks earlier had drawn the largest television audience in history. He earned $50,000 for three appearances, a staggering sum for a 21-year-old truck driver from Mississippi. The host privately called him 'a decent, fine boy' while publicly declaring the performance unsuitable for family television."
43,2026-04-14,Tuesday,0,"First McDonalds Opens",1955,4,1,"First McDonald's Franchise Opens","Disneyland opened its gates in Anaheim that same summer","Rosa Parks refused to give up her bus seat in Montgomery months later","The franchising salesman who built the empire wasn't the founder — he was a 52-year-old milkshake machine vendor who walked into a San Bernardino hamburger stand and saw the future. The original brothers had already perfected their 'Speedee Service System,' serving a burger in 30 seconds. He bought them out for $2.7 million; their handshake deal for ongoing royalties was never honored."
44,2026-04-14,Tuesday,1,"Disneyland Opens",1955,4,1,"Disneyland Opens","James Dean's final film was released that same year","The Salk polio vaccine had just been declared safe months earlier","Opening day was such a disaster that insiders still call it 'Black Sunday' — temperatures hit 100°F, asphalt softened under women's heels, and counterfeit tickets doubled the crowd. A plumbers' strike forced a choice between working toilets and working water fountains; the creator chose toilets. The park recouped its entire $17 million construction cost within seven weeks."
45,2026-04-14,Tuesday,2,"First Barbie Doll",1959,5,1,"First Barbie Doll Released","Alaska and Hawaii became states that same year","Fidel Castro had just seized power in Havana weeks earlier","She was inspired by a German novelty doll originally marketed to adult men as a gag gift. The creator's male business partners all argued that mothers would never buy their daughters a doll with breasts; 300,000 sold in the first year. Her full name — Barbara Millicent Roberts — was never printed on a box."
46,2026-04-15,Wednesday,0,"Pac-Man Released",1980,5,1,"Pac-Man Released","The designer wanted to create something women and couples would play on dates","The US boycotted that summer's Olympics in the host city","The original Japanese name was changed for Western markets because distributors feared vandals would alter the first letter. It earned $2.5 billion in quarters within its first 15 months. The kill screen on level 256, caused by an integer overflow, was not beaten legitimately until 1999."
47,2026-04-15,Wednesday,1,"Super Mario Bros Released",1985,5,1,"Super Mario Bros Released","The North American console market had collapsed two years prior and retailers refused to stock games","Live Aid concerts raised millions for Ethiopian famine relief that same summer","The game was designed as the pack-in title for a console that retailers initially refused to carry. Its creator had no formal programming training and composed the music himself. The game sold 40 million copies — without internet distribution — and single-handedly resurrected a home entertainment industry that analysts had declared permanently dead."
48,2026-04-15,Wednesday,2,"Tetris Released",1984,6,1,"Tetris Released","Its creator worked at the Soviet Academy of Sciences and initially received no royalties","George Orwell's dystopian year had just passed with surprising calm","The licensing rights became the subject of the most byzantine legal battle in gaming history — the Soviet government, a British software company, and multiple American publishers all claimed ownership simultaneously. Its designer earned nothing from the game's first decade of global sales. Cognitive scientists later discovered it literally changes brain structure, thickening the cortex in regions governing spatial reasoning."
