Puzzle #,Date,Day,Slot,Event,Year,Difficulty,Tier,Headline,Clue 1,Clue 2,Context Card
49,2026-04-16,Thursday,0,"PlayStation Launched",1994,6,1,"PlayStation Launched","The console was born from a failed partnership with its future rival's cartridge-based system","","It began as a CD-ROM add-on for a competitor's console, but the partnership collapsed in a public betrayal at a trade show. The jilted partner channeled that anger into a standalone machine that used cheaper disc media, undercut the competition by $100, and sold over 100 million units — inaugurating a new era of 3D gaming that made sprites feel instantly obsolete."
50,2026-04-16,Thursday,1,"Xbox Announced",2001,6,1,"Xbox Announced","The September 11 attacks delayed the console's European launch by months","","The machine was essentially a stripped-down PC running a custom operating system, which horrified gaming purists. Internal memos reveal the company lost an estimated $125 on every unit sold, treating the entire venture as a $4 billion bet to control the living room. Its online service, bundled with an Ethernet port when competitors still used dial-up, would eventually reshape how the entire industry thought about multiplayer gaming."
51,2026-04-16,Thursday,2,"First iPod Released",2001,6,1,"First iPod Released","Portable MP3 players already existed, but this one used a tiny hard drive from a Japanese manufacturer","","Critics mocked the $399 price tag — 'no wireless, less space than a Nomad, lame,' read the most famous review. The device accounted for less than 2% of the company's revenue in its first year. Within six years it would generate half the company's income and lead directly to the product that would make it the world's most valuable corporation."
52,2026-04-17,Friday,0,"Netflix Streaming Launches",2007,7,1,"Netflix Streaming Launches","The first iPhone shipped that same summer, giving streaming a mobile future","","The streaming library at launch contained just 1,000 titles — less than a single Blockbuster store. The company had offered to sell itself to its brick-and-mortar rival for $50 million three years earlier and been laughed out of the room. That rival filed for bankruptcy three years after streaming launched; the streamer is now worth more than $150 billion."
53,2026-04-17,Friday,1,"Spotify Launches",2008,7,1,"Spotify Launches","The global financial crisis was unfolding as the service launched in Sweden","","It launched in invitation-only mode in a single European country, paying fractions of a cent per stream while the music industry was still prosecuting teenagers for illegal downloads. Major labels initially licensed their catalogs only because they were desperate — CD sales had fallen by half in a decade. The model musicians mocked as 'paying in pennies' now generates more revenue for the recording industry than CDs ever did at their peak."
54,2026-04-17,Friday,2,"Facebook Launched",2004,7,1,"Facebook Launched","Gmail launched in invitation-only beta that same year","","Registration required a valid university email address, and the site spread campus by campus — a deliberate scarcity strategy that created desperate demand at schools not yet invited. Within 24 hours of launching at each new university, more than half the student body had signed up. The founder was 19 years old, running the servers from his dormitory room."
55,2026-04-18,Saturday,0,"Twitter Launched",2006,7,1,"Twitter Launched","A 140-character whisper that turned every phone into a printing press","","The original prototype was built in two weeks as a side project at a podcasting startup, and the first message — 'just setting up my twttr' — had all the grandeur of a throat-clearing cough. The 140-character limit was dictated by SMS technology, not philosophy. It would take an earthquake in Haiti, an uprising in Tehran, and an Arab Spring to reveal what a short-message platform could actually become."
56,2026-04-18,Saturday,1,"Snapchat Launched",2011,8,1,"Snapchat Launched","Born in a world where every photo was forever, promising that nothing had to be","","Every investor said an app built on impermanence was fundamentally worthless. A major social network offered $3 billion in cash to acquire it; the 23-year-old CEO declined. The feature everyone assumed was designed for sexting turned out to be what teenagers actually wanted: a way to communicate without building a permanent, searchable archive of their adolescence."
57,2026-04-18,Saturday,2,"Bitcoin White Paper",2008,8,1,"Bitcoin White Paper Published","Lehman Brothers had collapsed weeks before, and trust in banks was at a generational low","","The nine-page paper was posted to an obscure cryptography mailing list and received almost no attention. Embedded in the code of the first-ever block was a headline from The Times of London about bank bailouts — a quiet political statement disguised as a timestamp. The author vanished completely in 2011, leaving behind roughly one million tokens now worth tens of billions, never moved from their original addresses."
58,2026-04-19,Sunday,0,"Ethereum Launches",2015,9,1,"Ethereum Launches","","","Its creator was a 21-year-old college dropout who decided the original digital currency was too limited — like a calculator when the world needed a computer. He funded the project through a public token sale that raised $18 million in digital currency. The platform's name was chosen from a list of science fiction concepts found on Wikipedia."
59,2026-04-19,Sunday,1,"First NFT Minted",2014,9,1,"First NFT Minted","","","The first known experiment linked a short animation to a blockchain entry and declared it a unique, ownable digital object — a concept that sounded absurd to anyone who understood how copying a file works. The technology languished in obscurity for years before a $69 million auction made the art world pay attention in 2021. The inevitable crash wiped out 95% of values within two years."
60,2026-04-19,Sunday,2,"Columbus Reaches Americas",1492,10,1,"Columbus Reaches the Americas","","","The navigator died believing he had reached Asia, never acknowledging the continental landmass his voyages had revealed to European mapmakers. The Taíno people he encountered had inhabited the Caribbean for at least 1,500 years. Within 50 years of first contact, disease, enslavement, and violence had reduced the Taíno population from an estimated 250,000 to fewer than 500."
61,2026-04-20,Monday,0,"Magna Carta Signed",1215,4,1,"Magna Carta Signed","The Crusades were still being fought in the Holy Land","Oxford University had already been teaching for decades","The meadow at Runnymede was chosen because neither side trusted the other enough to meet indoors. King John sealed the charter under duress, then immediately asked the Pope to annul it — which he did within ten weeks. The document failed as a peace treaty but survived as the foundation of constitutional law across the English-speaking world."
62,2026-04-20,Monday,1,"Shakespeare Born",1564,4,1,"Shakespeare Born","Elizabeth I had recently been crowned queen","Galileo was a newborn in Pisa","Born in a market town best known for its wool trade, the playwright received a solid grammar school education but never attended university — a fact his rivals never let him forget. He would go on to invent over 1,700 English words, from 'assassination' to 'lonely.' His father made gloves; his son died at eleven."
63,2026-04-20,Monday,2,"Star Wars Released",1977,3,1,"Star Wars Released","Jimmy Carter was in his first year as US president","The Apple II personal computer went on sale that same year","Twentieth Century Fox was so certain the film would fail that it let the director keep merchandising rights — a decision that would cost the studio billions. Shot partly in the Tunisian desert, where a nearby Libyan military operation nearly shut down production, it earned $461 million worldwide and redefined what a movie could sell."
64,2026-04-21,Tuesday,0,"Jaws Released",1975,3,1,"Jaws Released","The Watergate scandal had just forced a president to resign","Saturday Night Live premiered on NBC that same fall","The mechanical shark malfunctioned so often that the young director was forced to hide it, showing only glimpses — a constraint that accidentally invented modern suspense filmmaking. Beaches across America emptied that summer despite record heat. The film's success created the template every studio still follows: wide release, massive marketing, summer launch."
65,2026-04-21,Tuesday,1,"ET Released",1982,4,1,"E.T. the Extra-Terrestrial Released","The Falklands War was being fought that same spring","Michael Jackson's Thriller album was released later that year","The film was born from loneliness — the director conceived it while imagining an imaginary friend after his parents' divorce. M&M's famously declined a product placement deal, so the production used Reese's Pieces instead, tripling the candy's sales overnight. It became the highest-grossing film in history, a record it held for eleven years."
66,2026-04-21,Tuesday,2,"Jurassic Park Released",1993,4,1,"Jurassic Park Released","The European Union was formally established that same year","Nirvana's In Utero album was released weeks later","The novel's team pivoted from animatronics to an untested technique — computer-generated imagery for living creatures. The result — six minutes of CGI dinosaurs in a two-hour film — convinced every studio in Hollywood that practical effects were finished. The paleontology department at many universities saw enrollment double within a year."
67,2026-04-22,Wednesday,0,"The Matrix Released",1999,4,1,"The Matrix Released","The Y2K bug had the world bracing for digital collapse","The euro currency was introduced to financial markets that January","The directors pitched the film with a comic book because no studio could visualize what they were describing. Every lead actor in Hollywood turned down the role before it was offered to a star best known for action comedies. The 'bullet time' effect required 120 still cameras firing in sequence — borrowed from a 19th-century photographer who used it to study galloping horses."
68,2026-04-22,Wednesday,1,"Avatar Released",2009,5,1,"Avatar Released","Barack Obama had just been inaugurated as US president","The world was deep in the worst financial crisis since the Great Depression","The director waited fourteen years to make the film because the technology he needed did not exist yet. When it finally opened, it earned a billion dollars in just seventeen days. Its pioneering 3D technology was supposed to transform cinema forever; within five years, audiences had largely abandoned the format."
69,2026-04-22,Wednesday,2,"Sony Walkman Released",1979,5,1,"Sony Walkman Released","Margaret Thatcher had just become Britain's first female prime minister","The Soviet Union had recently invaded Afghanistan","The device was rejected by every division inside the company before one engineer championed it. Its co-creator was so impatient with the prototype that he dunked it in an aquarium — when bubbles rose, he declared there was still space inside to make it smaller. It sold 200 million units and turned headphones from studio equipment into street fashion."
70,2026-04-23,Thursday,0,"VHS Format Introduced",1976,5,1,"VHS Format Introduced","The United States was celebrating its bicentennial","","The format war between VHS and its rival Betamax had nothing to do with quality — Betamax was technically superior. VHS won because its tapes could record for two hours, long enough to capture a full movie, while Betamax initially maxed out at one. The adult film industry's early adoption of VHS may have tipped the balance, though the companies involved have always denied it."
71,2026-04-23,Thursday,1,"CD Player Released",1982,6,1,"CD Player Released","The Falklands War dominated the news that spring","","The disc's diameter — 12 centimeters — was allegedly chosen so it could hold all of Beethoven's Ninth Symphony without interruption. Early players cost more than $700, and only about fifty albums were available at launch. The format would eventually kill the vinyl record, then be killed itself by the MP3."
72,2026-04-23,Thursday,2,"Kodak Founded",1888,6,1,"Kodak Camera Introduced","Jack the Ripper was terrorizing London's East End","","The founder's slogan was 'You press the button, we do the rest' — and he meant it literally. The camera came preloaded with a 100-exposure roll; when finished, customers mailed the entire device back to the factory. It democratized photography by removing every technical barrier, turning a specialist craft into a household habit."
73,2026-04-24,Friday,0,"Polaroid Camera Released",1948,6,1,"Polaroid Camera Released","The Berlin Airlift was keeping a city alive that same year","","The inventor's three-year-old daughter asked why she couldn't see the photo he had just taken of her — and that question launched a billion-dollar company. The first camera weighed nearly four pounds and produced sepia-toned prints that had to be coated with fixative by hand. Andy Warhol would later make the instant photograph an art form, carrying one everywhere he went."
74,2026-04-24,Friday,1,"Digital Camera Invented",1975,7,1,"Digital Camera Invented","The Vietnam War had just ended with the fall of Saigon","","The prototype weighed eight pounds, took 23 seconds to record an image, and produced a 0.01 megapixel black-and-white photograph. The engineer who built it presented his invention to corporate leadership, who told him to bury it: the company's entire business was built on selling film. Three decades later, that same company filed for bankruptcy because digital photography had destroyed its market."
75,2026-04-24,Friday,2,"Ford Model T Released",1908,7,1,"Ford Model T Released","The Wright brothers' first flight was still recent memory","","The assembly line did not start with the car — it started with the price. The founder was obsessed with making a car cheap enough for his own factory workers to buy, and the moving assembly line was simply the method that got the price from $850 down to $260. By the time production ended, half of all cars on American roads were the same model."
76,2026-04-25,Saturday,0,"First Commercial Airplane Flight",1914,7,1,"First Commercial Airplane Flight","The old world was about to tear itself apart","","The flight lasted 23 minutes, covered 21 miles across a bay, and the only passenger was the mayor of the destination city, who had won the seat at auction. The pilot made the trip twice daily for four months before the airline folded — there simply were not enough passengers. It would take another decade before commercial aviation became a real industry."
77,2026-04-25,Saturday,1,"Sputnik Launched",1957,8,1,"Sputnik Launched","Leave It to Beaver was America's picture of itself","","The satellite was the size of a beach ball and carried no scientific instruments — it could only transmit a simple radio pulse. But that beep, picked up by amateur radio operators worldwide, proved that the rival superpower had rockets powerful enough to reach any city on Earth. Within a year, the stunned response produced NASA, a new science curriculum for American schools, and the modern concept of the technology race."
78,2026-04-25,Saturday,2,"Hubble Telescope Launched",1990,8,1,"Hubble Space Telescope Launched","The wall between East and West had just crumbled","","The telescope was delivered to orbit with a flaw in its primary mirror — a manufacturing error of just 2.2 micrometers, about one-fiftieth the width of a human hair. For three years it sent back blurry images. Astronauts installed corrective optics during a spacewalk, and the telescope went on to fundamentally change humanity's understanding of the age and size of the universe."
79,2026-04-26,Sunday,0,"Mars Pathfinder Landing",1997,8,1,"Mars Pathfinder Landing","","","The rover was the size of a microwave oven and was designed to last seven days. It lasted eighty-three. Named through a student essay contest, the little machine analyzed rocks and sent back 2.3 billion bits of data, proving Mars had once been warm and wet. The mission cost less than the production budget of a Hollywood blockbuster released that same summer."
80,2026-04-26,Sunday,1,"Gutenberg Bible Printed",1455,9,1,"Gutenberg Bible Printed","","","The printer was nearly bankrupt before the first Bible rolled off his press — he had borrowed heavily and his investor eventually sued him, seizing the equipment. The original print run was about 180 copies, of which 49 survive today, each worth tens of millions of dollars. Within fifty years, an estimated twenty million volumes had been printed across Europe, ending the Church's monopoly on knowledge."
81,2026-04-26,Sunday,2,"Roman Empire Falls",476,9,1,"Fall of the Western Roman Empire","","","The final emperor was a teenager, installed as a puppet by his father, a Germanic general who actually held the power. The barbarian king who deposed him did not even bother to claim the title — he simply sent the imperial regalia to Constantinople and declared the western office unnecessary. The eastern half of the empire would continue for nearly another thousand years."
82,2026-04-27,Monday,0,"Great Fire of London",1666,4,1,"Great Fire of London","The Great Plague had devastated the same city just a year before","Isaac Newton was a young student developing his theory of gravity","The fire began in a bakery on Pudding Lane shortly after midnight and burned for four days, destroying 13,200 houses, 87 churches, and old St Paul's Cathedral. Remarkably, only six verified deaths were recorded. The architect appointed to rebuild the city designed 51 new churches, including a cathedral that took 35 years to complete."
83,2026-04-27,Monday,1,"The Beatles' First US TV Appearance",1964,3,1,"The Beatles on Ed Sullivan","The president had been assassinated just weeks before","Martin Luther King Jr. would receive the Nobel Peace Prize later that year","When The Beatles landed at JFK Airport on February 7, 1964, they were met by 3,000 screaming fans — the largest welcome in airport history to that point. They appeared on The Ed Sullivan Show ten days later, watched by 73 million viewers. Within weeks, Beatlemania had completely reshaped American pop music and youth culture."
84,2026-04-27,Monday,2,"Woodstock Festival",1969,3,1,"Woodstock Festival","Humans had walked on the moon just weeks earlier","Richard Nixon was in his first year as president","The festival was supposed to happen in a different town entirely — the original site pulled the permit a month before the event. A dairy farmer agreed to lease his land, and within weeks his alfalfa field became a temporary city with no fences and no way to collect tickets. The promoters lost over a million dollars. The farmer said he would do it again."
85,2026-04-28,Tuesday,0,"Live Aid Concert",1985,4,1,"Live Aid Concert","A hole in the ozone layer was discovered that same year","Nintendo released its first home console in North America that October","The concert was organized in ten weeks — an impossibly short timeline for an event broadcast live to 1.9 billion people across 150 countries. The London and Philadelphia stages ran simultaneously, connected by satellite. It raised $127 million for famine relief, but its lasting impact was proving that television could turn a concert into a global event and shame governments into action."
86,2026-04-28,Tuesday,1,"MTV Launches",1981,4,1,"MTV Launches","The first Space Shuttle mission launched that same spring","Prince Charles married Lady Diana that summer","The first video ever played was a deliberate joke — a song about how television had disrupted an earlier medium. At launch, the channel could only be received in a few thousand homes in New Jersey. Record labels initially refused to provide videos, so the same handful of clips ran on heavy rotation for months. Within three years, an artist's visual image had become as important as their sound."
87,2026-04-28,Tuesday,2,"Napster Launches",1999,4,1,"Napster Launches","The Y2K bug dominated headlines that December","The Sopranos had just premiered on HBO","Two college freshmen built the service in a dorm room, and within a year it had more users than most countries have people. The recording industry sued, calling it the biggest threat to copyright since the photocopier. The legal battle shut it down, but the damage was done — an entire generation had learned that music could be free, and the industry spent the next decade trying to unlearn that lesson."
88,2026-04-29,Wednesday,0,"iTunes Store Opens",2003,4,1,"iTunes Store Opens","The US had invaded Iraq weeks earlier","The Human Genome Project was completed that same spring","The music industry had spent four years suing teenagers and losing the public relations battle when a tech company proposed a radical idea: make buying music easier than stealing it. The store sold one million songs in its first five days. Within six years, it was the largest music retailer in the United States, and CDs were relics."
89,2026-04-29,Wednesday,1,"The Berlin Wall Falls",1989,4,1,"The Berlin Wall Falls","The Tiananmen Square protests had been crushed just months before","The first episode of The Simpsons aired that December","For 28 years, Checkpoint Charlie was the defining symbol of the Cold War. On November 9th, 1989, a confused bureaucrat announced that East Germans could cross freely — and thousands flooded through. No one had planned the announcement. The wall fell because the system was already crumbling."
90,2026-04-29,Wednesday,2,"World War I Begins",1914,5,1,"World War I Begins","The Panama Canal had just opened for business","Charlie Chaplin made his first film appearance that same year","The assassination of Archduke Franz Ferdinand in Sarajevo on June 28, 1914, set off a chain reaction of alliance obligations. What was supposed to be a short war became a four-year conflict that killed 17 million people and destroyed four empires: the German, Austro-Hungarian, Ottoman, and Russian empires."
